{
  "name": "ACM工作室",
  "slogan": "以代码为笔，讲清每一道算法",
  "focus": "专注算法竞赛的程序设计工作室",
  "description": "大连民族大学 ACM 工作室是一支专注于算法竞赛的大学生程序设计团队，长期参与 ICPC、CCPC、蓝桥杯等赛事。我们坚信：**把一道题真正讲清楚，才是掌握它的最好方式**。本网站用于沉淀算法笔记、开放算法可视化实验台、展示历届荣誉与队员风采，由历届成员持续共创与维护。",
  "history": [
    {
      "season": "2022-2023",
      "summary": "工作室成立，首获 ICPC 亚洲区域赛铜奖。"
    },
    {
      "season": "2023-2024",
      "summary": "扩充算法笔记体系，建立实验台雏形。"
    }
  ],
  "contests": [
    {
      "name": "ICPC",
      "type": "ICPC"
    },
    {
      "name": "CCPC",
      "type": "CCPC"
    },
    {
      "name": "码蹄杯",
      "type": "码蹄杯"
    },
    {
      "name": "蓝桥杯",
      "type": "蓝桥杯"
    },
    {
      "name": "百度之星",
      "type": "百度之星"
    },
    {
      "name": "PTA 团体程序设计大赛",
      "type": "PTA 团体程序设计大赛"
    },
    {
      "name": "辽宁省程序设计大赛",
      "type": "辽宁省程序设计大赛"
    }
  ],
  "contact": {
    "qqGroup": "XXXXXXXXX",
    "email": "acm@example.edu.cn",
    "recruitNotice": "招新通道现已开启：诚邀对算法竞赛感兴趣的同学加入，共同参与赛事、编写笔记并维护本站。"
  }
}